path	sentence	client_id
common_voice_ckb_29350929.mp3	داخت ها وە بان هەچێ داخەوە	
common_voice_ckb_29350935.mp3	شوشتنی دەست بە باشی بە ئاوی ڕۆیشتوو	
common_voice_ckb_29350939.mp3	ژەنەڕاڵێکی ئەمریکی بووە لەنەتەوەیەکگرتوەکان	
common_voice_ckb_29350956.mp3	بۆ تۆ نەمام ڕوومەت کاڵ	
common_voice_ckb_29350959.mp3	بۆقەکە لە گۆمەکەدایە	
common_voice_ckb_29350961.mp3	ئەرێ هەر چاوەکانم بە ماڵی تۆیە	
common_voice_ckb_29350963.mp3	بۆ تەندروستی خۆم باشە	
common_voice_ckb_29351018.mp3	کافرن مەزە چەوتن	
common_voice_ckb_29351026.mp3	وەک مامۆستا سەجادی دەیگێڕێتەوە	
common_voice_ckb_29351029.mp3	لێم هەڵکێشا خەنجەرێ	
common_voice_ckb_29351033.mp3	یەکێکە لە خاوەن ڕووبەرە بچووکەکان	
common_voice_ckb_29351042.mp3	زۆرینەی حکومەتەکانی جیهان هاوڵاتیانی خۆیانیان ئامۆژگاری کردوە کە گەشتی ناپێویست نەکەن لە ناوەڕاستی بڵاوبوونەوەکەدا	
common_voice_ckb_29351088.mp3	هەموو زانیارییەکی پێویستی سەبارەت بە زمانی کوردی لە خۆگرتووە	
common_voice_ckb_29351091.mp3	تیمەکەی ئێمەش لە کاتی خۆیدا ڕێنماییەکەی ئێمە نوێ دەکاتەوە بۆ پێشکەشکردنی یارمەتی	
common_voice_ckb_29351105.mp3	کام دە کادێنێ دەکرد مانگایەکی لێم مووشان	
common_voice_ckb_29351110.mp3	ئەمە هەڵەیەکە	
common_voice_ckb_29351113.mp3	شارێکی باشووری کوردستانە کە ناوەندی پارێزگای سلێمانییە	
common_voice_ckb_29351132.mp3	بەڵام زەوی تورکمانەکان بەتایبەت ئەوانەی شهەید و بریندار بوون خانوو و دێیەکانمان ڕووخان	
common_voice_ckb_29351137.mp3	خاڵی لاوازمان گوندە عەرەبنشینەکانن	
common_voice_ckb_29351143.mp3	گۆبی بیابانێکی سێبەری باراناویە	
common_voice_ckb_29351145.mp3	ژینی لادێ سەیرانە	
common_voice_ckb_29351148.mp3	یاقووت و گەنج و گەوهەر	
common_voice_ckb_29351170.mp3	شەو دێ لێم بێزارە	
common_voice_ckb_29351171.mp3	یەک لە یەک بە قیمتتر	
common_voice_ckb_29351206.mp3	تاوانم دەبێ چ بێ لەیلم هۆ لەیلم هۆ لەیلم هۆ	
common_voice_ckb_29351209.mp3	هیوادارم سەرکەوتووبیت	
common_voice_ckb_29351210.mp3	هەزاری کورسی نشین	
common_voice_ckb_29351213.mp3	سێ ساڵ لە حەزرەتی حەسەن گەورەتر بوو	
common_voice_ckb_29351215.mp3	بۆ خەزایە دین بەتاڵ	
common_voice_ckb_29351264.mp3	وێنەیەک دەنێرمە سەر شاشەکەت	
common_voice_ckb_29351266.mp3	توێژینەوەیەک دەریخستووە کە ڕێژەی هەوکردن کەمیکردووە بە دەست شوشتن	
common_voice_ckb_29351267.mp3	شێوازی شیکردنەوەی نەخۆشییەکە	
common_voice_ckb_29351270.mp3	دەستمان بە فراوانکردنی بەشەکانی پزیشکیی خێزانیی کردووە	
common_voice_ckb_29351271.mp3	ئەوانەی لەوێ کاردەکەن مۆڵەتیان بۆ مەساج وەرگرتووە نەوەک کاری دیکە	
common_voice_ckb_29351282.mp3	بۆ پێشمەرگەو خەڵکی کوردستان	
common_voice_ckb_29351285.mp3	گوڵەکەم دەڵێن ئەوا دێ	
common_voice_ckb_29351290.mp3	تاریفی تەواو نابێ	
common_voice_ckb_29351293.mp3	ناردوومە جەڕەی بۆ بێ	
common_voice_ckb_29351314.mp3	ەوونەر یانی دەربڕینی هەستی مرۆڤ بەشێوەی جیاواز	
common_voice_ckb_29351315.mp3	دوای تەواوبوونی خوێندنەکەی	
common_voice_ckb_29351316.mp3	تەمەنی گەیشتە حەوت ساڵان	
common_voice_ckb_29351318.mp3	وا گەشایەوە بۆ حاڵی زارم	
common_voice_ckb_29351328.mp3	چارەسەرێکی ئەوتۆی ناوێت	
common_voice_ckb_29351329.mp3	وەکو شمقاری خاڵخال بوو	
common_voice_ckb_29351330.mp3	کەمەندت لە ملی دەخەم حەڕەمت بۆ خۆم دەبەم	
common_voice_ckb_29351331.mp3	لە وڵاتانی ئاسیا و ئەفریقادا دەژین	
common_voice_ckb_29351332.mp3	دووەمیشیان ئەوانەن کە هەموو بابەتەکە دەخوێننەوە	
common_voice_ckb_29351370.mp3	سەیرە لە دووری جوانێ شەمعم بوومە پەروانە	
common_voice_ckb_29351379.mp3	شاهێدیم بۆ بدە لە گولەی خەسارە	
common_voice_ckb_29351382.mp3	لە قوتابخانە دانیشتم	
common_voice_ckb_29351412.mp3	بێگومان ئێستا ئاو و هەواکەی گەرمترە	
common_voice_ckb_29351413.mp3	ئەتۆ تێیدا پکە حوکمات	
common_voice_ckb_29351426.mp3	ئاخ لەو هەستە جوانەی شێعرەکانی نالی	
common_voice_ckb_29351431.mp3	من دەڵیم تۆ گوێ بدێرە	
common_voice_ckb_29351435.mp3	خەڵکی کام شاری	
common_voice_ckb_29353744.mp3	مەعلووم نییە ڵە دڵی نەبێتە سەرەتان	
common_voice_ckb_29353747.mp3	مەرجە نیشانەکان لە دوو شوێنی جیاواز یان زیاتر دا هەبن	
common_voice_ckb_29353748.mp3	هەی بێنن بێنن کەژاوە بێنن	
common_voice_ckb_29353750.mp3	دار هەڵبڕە سەگی دز دیارە	
common_voice_ckb_29383606.mp3	ئەویش وەکوو من ئالوودەی دەردە	
common_voice_ckb_29383608.mp3	لێمان شێواوی دەڵێی ڕەنجاوی	
common_voice_ckb_29383609.mp3	چی تر زیادکرا بەم ڕاپۆرتە	
common_voice_ckb_29383611.mp3	بەرد لە جێ ی خۆی سەنگینە	
common_voice_ckb_29383612.mp3	ئایا هاوکار بوویت لە چارەسەر کردنی چ کێشەیەکدا	
common_voice_ckb_29383627.mp3	پرچت بۆ وا ئاڵۆزە	
common_voice_ckb_29383630.mp3	هاوار بەفری ناچێتۆ	
common_voice_ckb_29383659.mp3	هەروەها گوێ لە کەسانی لەخۆت بە ئەزموونتر بگریت	
common_voice_ckb_29383660.mp3	ساڵە وەختی تێ وەر نە گەڕا	
common_voice_ckb_29383661.mp3	ئەمن و تۆ شاگردی وین بە ماڵە شێخ مەولانە	
common_voice_ckb_29383662.mp3	باوکم پیر بووە	
common_voice_ckb_29383663.mp3	نرکەی دێ وەکوو کوڕکوڕ	
common_voice_ckb_29383716.mp3	گرفتەکە چارەسەر نەکراوە	
common_voice_ckb_29383718.mp3	لە من و عەلی مەردانی	
common_voice_ckb_29383720.mp3	شێرە و مەردە و لە شەڕێ هەڵنایە	
common_voice_ckb_29383738.mp3	جافەرموی ئەستیێ سەر بە دوژوارە	
common_voice_ckb_29383739.mp3	ئەرێ کوانێ هات و چووی سەر هەوارانت	
common_voice_ckb_29383740.mp3	باش شارەزای ئەم شارەم	
common_voice_ckb_29383741.mp3	پاشان لەناو هەموو تۆڕەکانی تر بڵاوی بکەیتەوە	
common_voice_ckb_29383742.mp3	زووڵمی لێکرد و پارەکەی پێ نەدا	
common_voice_ckb_29383751.mp3	ملی باریکتر قاچی کەمێک کورتتر بێت	
common_voice_ckb_29383765.mp3	بە بیرکردنەوەوە لانە وتی تۆ ئامانجێکی هاوبەشت هەیە	
common_voice_ckb_29383777.mp3	نیشانەی نەخۆشییەکەیان تیادایە سەردانی پزیشک نەکەن	
common_voice_ckb_29383778.mp3	محەممەد پێی گوت یاری شەنگ جەماڵ	
common_voice_ckb_29383779.mp3	ڕێکخراوە حکوومەتییەکان بەدی ناکرێن	
common_voice_ckb_29383787.mp3	هەموومان کاتێکمان هەیە کە بەتەنها ەی خۆمان نییە	
common_voice_ckb_29383791.mp3	هەتا پردی دێگەڵە	
common_voice_ckb_29383803.mp3	غەریبی دوور وڵات	
common_voice_ckb_29383809.mp3	جاکوتی قەزنەفەرەی دولێرە	
common_voice_ckb_29383822.mp3	زوڵم و ستەم بە سەر چۆ چوون ئازادی بەیانە	
common_voice_ckb_29383854.mp3	ئەمەیە کە دەیزانم و پێشکەشی دەکەم	
common_voice_ckb_29383855.mp3	چەتەکانی داعش ڕەوانەی جەرابلوس دەکرێن	
common_voice_ckb_29383858.mp3	ئەوە قسەی ئاسۆ عومەر سوارەی ئەکتەرە	
common_voice_ckb_29383860.mp3	ئازاری سییەکان و خانە دیارکەوتوو بەربڵاوەکان و زیادکردنی ماکرۆفەیج لە نەخۆشەکانی سارس بەدیاردەکەون	
common_voice_ckb_29383985.mp3	کەشتیەکە نوقم بوو	
common_voice_ckb_29383987.mp3	ئەو بۆ میوانان دەبوو بە سەقاو	
common_voice_ckb_29383992.mp3	هەژار شاعیر و نووسەری کورد هەر بە هۆنراوە وەریگێڕاوەتەوە بۆ زاری موکریانی	
common_voice_ckb_29383999.mp3	هەرگیز نەوینم داخ لە دییەی تۆ	
common_voice_ckb_29384029.mp3	دانیشتبوو ئەو چاو مەستە	
common_voice_ckb_29384030.mp3	ئەرێ سەر بگرێ لە قوڕ جوانێ گیان سوبح و ئێوارێ	
common_voice_ckb_29384031.mp3	بە کفلە کوونێک ئەو دنیایەی داناوە	
common_voice_ckb_29384037.mp3	ژیان بەبێ دۆست ناکرێت	
common_voice_ckb_29384038.mp3	هاوار کەتانە	
common_voice_ckb_29384110.mp3	ئۆپەراسیۆنەکانی سوپای وڵاتەکەی بۆ ئەوەیە ڕێگری بکەن لە جێگیرکردنی پارتی یەکێتی دیموکرات	
common_voice_ckb_29384115.mp3	ئەم فیلمە بە نیشاندانی ئێوارەیەکی نەورۆزەوە دەست پێدەکات	
common_voice_ckb_29384119.mp3	لە ڕۆژی ئاخیرەتێ	
common_voice_ckb_29384205.mp3	دوربکەوەرەوە لە باوەش ماچکردن دەستەسڕ تۆقەکردن وە هەرجۆریکی تری پەیوەندیکردن	
common_voice_ckb_29384206.mp3	پێویستە پیاوانی ئاسایش هەبن بۆ وەڵامدانەوەی بێزاریکردنەکان و پاراستنی مافی هاوڵاتییان ؛ 	
common_voice_ckb_29384209.mp3	خۆتۆمارکردنی یاسای بەکارهێنانی ئۆنلاین یاخود وەرەقە لە	
common_voice_ckb_29384211.mp3	دوو زولفیان لە پشتەوە بڕی	
common_voice_ckb_29384225.mp3	وەک باز و نێچیری	
common_voice_ckb_29384227.mp3	وە تۆ وتت ئەمە وەکوو گوشارێکە لەسەر سنگت	
common_voice_ckb_29384228.mp3	جاکسن ناوی خێزانیی منە	
common_voice_ckb_29384280.mp3	کاتێک باسی بڵاگ یاخوود ماڵپەڕی تاکەکەسی کرا	
common_voice_ckb_29384281.mp3	گۆران شاعیرە	
common_voice_ckb_29384285.mp3	زانیار چاوەڕوانمە	
common_voice_ckb_29384317.mp3	خەبەریان برد بۆ شا ئەوانە	
common_voice_ckb_29384319.mp3	ئەگەر لە ئەرزەڕۆمێ هەڵ برد	
common_voice_ckb_29384344.mp3	کێشای شیر وقەددارە	
common_voice_ckb_29384349.mp3	خودا پشتیوانی پێشمەرگەیە	
common_voice_ckb_29384351.mp3	بەڵام هەناسەم توندە	
common_voice_ckb_29384352.mp3	لە مالیکی و عەبادی و نمونەی وەک ئەوان چاکتر نابن	
common_voice_ckb_29384370.mp3	تیرۆکی نانکردن	
common_voice_ckb_29384371.mp3	یەکێ ئەچێتە سەر دار	
common_voice_ckb_29384372.mp3	ڕاستە پەشێو پەیوەندی بە هیچ حیزبێکی کوردستانییەوە نییە	
common_voice_ckb_29384373.mp3	فیلمێکی زۆر باش بوو	
common_voice_ckb_29384374.mp3	تاوەکو ئەم دواییەش یاری تۆپی پێم دەکرد و زۆرم حەز لێییە	
common_voice_ckb_29384385.mp3	لۆمە مەکەن ساحەب یارن	
common_voice_ckb_29384386.mp3	ئێمە تێبینیمان کردووە منداڵان و مێردمنداڵان کێشەی بینینیان بۆ دروستبووە	
common_voice_ckb_29384387.mp3	سەرم ئازاری هەیە	
common_voice_ckb_29384388.mp3	کەروێشکی دەشتی ئودلێ	
common_voice_ckb_29384389.mp3	جا مچوڕکێکم پێدا هات	
common_voice_ckb_29384425.mp3	بۆچی داوای پارە لە من دەکەیت	
common_voice_ckb_29384428.mp3	ئەوەی شۆکی کردم ئەوەبوو خەڵکم نەدی وەرزشی ڕاکردن بکەن	
common_voice_ckb_29385863.mp3	لە شارەکەی حەلەبجە	
common_voice_ckb_29385864.mp3	حەزم لە خواردنی چوکلێتە	
common_voice_ckb_29385865.mp3	ماچی کردم ماچم کرد	
common_voice_ckb_29385867.mp3	کلک بەیداغی شاهانە	
common_voice_ckb_29385897.mp3	پەشێو تەئسیرێکی گەورەی کردە سەر بەشێک لە شاعیران و بەهرەدارانی شاری هەولێر	
common_voice_ckb_29385899.mp3	دارێکی گێلاسمان هەیە	
common_voice_ckb_29385900.mp3	هەر بەرنایە پەسیوە	
common_voice_ckb_29385901.mp3	لێم دەڕەنجی بەبێهۆ بۆچی بۆ	
common_voice_ckb_29385902.mp3	دە خدمەتیان دا هەمە بە ماڵە شێخ مەولانە	
common_voice_ckb_29385919.mp3	بەکارهێنانی دەمامکەکان پێشبینیکراوە بۆ ئەوانەی گومانیان لێدەکرێت کە ڤایرۆسەکەیان هەیە و چاودێریکەرەکانیان	
common_voice_ckb_29385922.mp3	تورک و ڕۆم و بارزانی	
common_voice_ckb_29385925.mp3	یا سینەم ئەیشێ یا خەفەخانە	
common_voice_ckb_29385927.mp3	تۆش بەجێم دێڵی	
common_voice_ckb_29385948.mp3	پەیوەندی دەکا بە یەکێتی قوتابیانی کوردستان	
common_voice_ckb_29385949.mp3	لێک بڵند دەبوون بە شیر	
common_voice_ckb_29385950.mp3	خەڵکی کوێن	
common_voice_ckb_29385951.mp3	هەستی پێدەکەم لە شوێنەکانی دەورووبەری سنگمدا	
common_voice_ckb_29385952.mp3	ئەم کتێبە لە ئینگلتەرا چاپکراوە	
common_voice_ckb_29385953.mp3	بە ئەجەلە و دەستووبرد	
common_voice_ckb_29385954.mp3	بەهۆی قەیرانە داراییەکان و هەندێک گرفتی کارگێڕییەوە پرۆژەکە وەستا	
common_voice_ckb_29385955.mp3	تەمەنی چوار ساڵان بووە	
common_voice_ckb_29385957.mp3	ئەمە بەتایبەتی ڕاستە بۆ ئەو دایک و باوکانەی پەروەردە یان سەرچاوەیان سنوردارە	
common_voice_ckb_29385958.mp3	لەبەر نازی ئەو شاخانە	
common_voice_ckb_29385959.mp3	زێڕێکیش بدەن بەوی دیکە	
common_voice_ckb_29385960.mp3	دەمویست بڵێم نا	
common_voice_ckb_29385961.mp3	لەلایەن پێشمەرگەوە تەقەیان لێکرا	
common_voice_ckb_29385962.mp3	بڕێکیش ڕێژی بکڕە	
common_voice_ckb_29385968.mp3	وڵاغەکەی لێ وەرگرت	
common_voice_ckb_29385969.mp3	دۆگلاس سەرکردەی هێزەکانی ئەمریکا بووە لە فلیپین	
common_voice_ckb_29385970.mp3	کاتێک کەمترین پێوانە تۆمارکرا قوتابخانەکان دەکرێ بگۆڕێن بۆ لە یەکەوە بۆ سێ ئەستێرە	
common_voice_ckb_29385971.mp3	کای کۆن بەبا مەکە	
common_voice_ckb_29385978.mp3	ئای سەییدیم بۆ خۆش بێ	
common_voice_ckb_29385979.mp3	مەیلم بدەیە یان زۆر و یان کەم	
common_voice_ckb_29385980.mp3	ناتوانین زانیاری ورد لەسەر گوندەکان کۆبکەینەوە	
common_voice_ckb_29385983.mp3	سەرەڕای ئەوەش سیستەمی تەندروستی ئەڵمانیا هێشتا نەیبەزاندووە	
common_voice_ckb_29385984.mp3	چەپڵە بە یەک دەست لێ نادرێت	
common_voice_ckb_29385985.mp3	نێرگەلە زیانی زۆری هەیە	
common_voice_ckb_29385986.mp3	بە شاخ و داخ و زەردا	
common_voice_ckb_29385987.mp3	ناوەکەم خۆشە	
common_voice_ckb_29385993.mp3	سوبح و ئێوارە ماچ قەرزدارە	
common_voice_ckb_29385994.mp3	قزلەر خۆشە پیرەمەگروون لە شانی	
common_voice_ckb_29385996.mp3	تەمەنی مامناوەندی خەڵکی ئەم وڵاتە	
common_voice_ckb_29385997.mp3	باشی و خراپی سکرتێر لەوانەیە پەیوەندی بە میزاجی ئەو کەسەوە هەبێت	
common_voice_ckb_29386009.mp3	من ئیستا سەرقاڵی ئیشم دواتر وەرەوە	
common_voice_ckb_29386010.mp3	بەینۆ بەینۆ هاتن هاتن دەستەی دڵداران	
common_voice_ckb_29386012.mp3	پاڵەوانی وەک تۆ نییە	
common_voice_ckb_29386014.mp3	ئەرێ ئەوشەو شەو پاییزە	
common_voice_ckb_29386044.mp3	کێشەی تەکنیکی لە پەخشی تەلەڤیزیۆن	
common_voice_ckb_29386047.mp3	ئەوە هەڵەیە و نابێت بوونی هەبێ	
common_voice_ckb_29386050.mp3	سێ گەز بە گەزی کوردی	
common_voice_ckb_29386051.mp3	ڕاو لە کۆنە لاجانێ	
common_voice_ckb_29386072.mp3	بڵاگێکی تاکەکەسییە لە هەموو ئەو بابەتانە پێک دێن کە خۆم دەینووسم یا ئاماژەی پێدەدەم	
common_voice_ckb_29386073.mp3	لەبەریان دەکرد جوببیەکی پیغەمبەرە	
common_voice_ckb_29386076.mp3	دەرناچم لە مەنتەقە	
common_voice_ckb_29386080.mp3	قامک پڕ لە ئەنگوستیلە	
common_voice_ckb_29386108.mp3	لە موسوڵمانەتی دا هەیە	
common_voice_ckb_29386109.mp3	هیچ دەرمانێک یاخود پێکوتەیەک پەسەند نەکراوە بۆ چارەسەری نەخۆشییەکە	
common_voice_ckb_29386136.mp3	بە ئیشارەی چاوەکانت	
common_voice_ckb_29386140.mp3	نەجیبم  لە دڵت لادە	
common_voice_ckb_29386142.mp3	تایر پەلەم لێ مەکە بە ماڵە شێخ مەولانە	
common_voice_ckb_29386154.mp3	بابەتەکە تەنها بریتی نییە لەوەی کە بابەتی زانستی و هۆشیاری بڵاوبکەینەوە	
common_voice_ckb_29386159.mp3	مەتەڵی هەڵاتن سووتانی تاقیگەکە	
common_voice_ckb_29386206.mp3	یەکێکی دیکەم ناوێت	
common_voice_ckb_29386207.mp3	سەرەڕای کاریگەریەکەیان پاکەرەوە بێ ئاویەکان هەموو بەشەکانی دەست بەتەواوی پاکناکەنەوە بەڵام بەسادەیی پاکیان دەکاتەوە	
common_voice_ckb_29386208.mp3	ئەڕواحی لێ دەکر دقات	
common_voice_ckb_29386209.mp3	حەقی دایکم دەستێنم	
common_voice_ckb_29386248.mp3	نرخی ئەو دراوە هەر دادەبەزێت	
common_voice_ckb_29386256.mp3	پاوانەی تێ کراوە	
common_voice_ckb_29386257.mp3	لە دهۆک دەژیت	
common_voice_ckb_29386258.mp3	هەر چارەم یار دەرمانە دوکتۆر	
common_voice_ckb_29386288.mp3	نیاگیە بان چاویەو مەمنوونم بووگە	
common_voice_ckb_29386292.mp3	دوای سڕینی لوت و کۆکین و پژمین	
common_voice_ckb_29386293.mp3	مەم و تاجدین جلی کچانە لەبەر دەکەن	
common_voice_ckb_29386294.mp3	هەر چۆنێک بێت بارە قورسەکان پشت دەبەستن بە شێ و پلەی گەرمی	
common_voice_ckb_29386317.mp3	ناشبێت ئەو چێژە گەورەیەمان لە یاد بچێت	
common_voice_ckb_29386318.mp3	باز نانیشێ لە سەر ئەو زولفانە	
common_voice_ckb_29386319.mp3	دەڵێن سێ دەفتەر دۆلاری دەوێ	
common_voice_ckb_29386321.mp3	خۆم دەزانم چەن سازگارە مێرگەپان	
common_voice_ckb_29386323.mp3	هەزاری وەک قەزنەفەر	
common_voice_ckb_29386396.mp3	دەی کلەی لە چاوان کەن مردم کەتانە	
common_voice_ckb_29386398.mp3	یارم گوڵە گەزیزە	
common_voice_ckb_29386400.mp3	هەتیو هەتیو هەتیوە و	
common_voice_ckb_29386401.mp3	چەندەم پێ دەکوتی مەچۆرە ماڵان	
common_voice_ckb_29386403.mp3	یەکێکی ترە لە جۆرەکانی بڵاگ	
common_voice_ckb_29386467.mp3	زەینەبێ وەی زەینەبێ زەینەبێ دوو ددانی زێڕە	
common_voice_ckb_29386468.mp3	یارم کراس شینە	
common_voice_ckb_29386469.mp3	تۆ بڵندان دەکەی نەوی	
common_voice_ckb_29386470.mp3	ئێستا وێنەیەکت بۆ دەنێرم	
common_voice_ckb_29386471.mp3	دیاریم بۆ هێناوی	
common_voice_ckb_29386493.mp3	ئێستا لە هۆڵی شانۆیی بۆلشۆی لە مۆسکۆی پایتەختی ڕووسیا نمایش دەکرێت	
common_voice_ckb_29386495.mp3	دنیا بە بێ زەماوەند	
common_voice_ckb_29386497.mp3	چەند کەس قۆڵبەست کران	
common_voice_ckb_29386500.mp3	لشکر ئەو بەر ئەو بەرە	
common_voice_ckb_29386513.mp3	دار بە تەوری وت گەر کلکت لە خۆم نە بوایە توانای بڕینمت نە دەبوو	
common_voice_ckb_29386514.mp3	کەسێک بیدینێ بەژنی دەتەزێ	
common_voice_ckb_29386516.mp3	تۆز گرتی بەری عاسمان	
common_voice_ckb_29386517.mp3	باشە من هەست بە ئازارێک دەکەم لە بەشی پێشەوەی جەستەم لە سنگمدا	
common_voice_ckb_29386546.mp3	جیهانپەیما دەخوڕی	
common_voice_ckb_29386549.mp3	ئەی یاری جانیجانی	
common_voice_ckb_29386551.mp3	ئێمە لەمەداین بەیەکەوە و لێرەین بۆ یارمەتیدان هەرچەندێک لە تواناماندابێت	
common_voice_ckb_29386552.mp3	شوێنی ڕێنمایەکانی پاکوخاوینی بکەوە هەروەک چۆن بۆ خۆ دورخستنەوە لە هەڵامەتی ئاسای ئەکرێ	
common_voice_ckb_29386699.mp3	بڕیارە لە دەستپێکی فێستیڤاڵی فیلمی تۆرێنتۆ دا نمایش بکرێت	
common_voice_ckb_29386700.mp3	هەروەها وەرگێڕانی چەند کورتە چیرۆک لە فارسییەوە	
common_voice_ckb_29386701.mp3	دارستانەکان دەبێ پارێزراو بن	
common_voice_ckb_29386703.mp3	توێژینەوەی زیاتر پێویستە بۆ ئەو کردارانەی کاریگەرترن لە ڕێخستنی چاودێری تەندروستی جیاواز	
common_voice_ckb_29386704.mp3	ساکەکەی بۆ هەڵدەگرم	
common_voice_ckb_29386740.mp3	کەمەندی شانە و شانت	
common_voice_ckb_29386742.mp3	ئەی هەوار ئامان هەی ئامان ئامان هۆ هۆ	
common_voice_ckb_29386747.mp3	پاشان دەبێت گرنگی بدەیت بە ڕێزمان و زاراوەسازی و ڕەوانبێژی و خاڵبەندی	
common_voice_ckb_29386750.mp3	لەو چاوە کاڵە لەو پرچە درێژە	
common_voice_ckb_29386817.mp3	ئیجازەم لە دایکی سەن	
common_voice_ckb_29386822.mp3	کۆنتڕۆڵکردنە بەڕێوبەریەکان گۆڕانکارین لە کاری ئاسیشی یان هەنگاوەکان کە داوای کردار دەکەن لەلایەن کرێکارانەوە	
common_voice_ckb_29386823.mp3	هەچ کەسێکی وەبەری هات	
common_voice_ckb_29386828.mp3	لە لیستەکاندا ستوونیەکەی ڕێژەی سەتی پشکنینی ئەرێنیە پەرەی پێدراوە لەلایەن پۆلیسی پشکنینی وڵاتەکەوە	
common_voice_ckb_29386832.mp3	بەرەو سیستەمێکی هاوچەرخ بۆ بەڕێوەبردنی شارەکانی کوردستان	
common_voice_ckb_29386859.mp3	گیان گیان خۆمی پێ ڕەش کەم	
common_voice_ckb_29386860.mp3	خودا پێکی هێنای کار و بارە	
common_voice_ckb_29386861.mp3	ئاورێک داییسا لە دوور	
common_voice_ckb_29386863.mp3	دوێنێ بە چاوی خۆم دەمدییە	
common_voice_ckb_29386864.mp3	تیرەک لێدان گڵەبان	
common_voice_ckb_29386934.mp3	هێزی بیسایی و بینایی زۆر بەهێزیان هەیە	
common_voice_ckb_29386937.mp3	کاتێک خۆشەویستییەکی زۆر بۆ هەر بابەتێک دەردەبڕیت	
common_voice_ckb_29386940.mp3	سووک بێ سینگیان هەڵ دێنم	
common_voice_ckb_29386943.mp3	بەڵام پێش ئەوەی تەواوی بکات دەستی لە خوێندن هەڵگرت	
common_voice_ckb_29386950.mp3	بەنداوەکانی دووکان دەربەندیخان و دهۆک	
common_voice_ckb_29386956.mp3	حەسەنی حاجی عەبدوول چوونکە لە تیپی وانە	
common_voice_ckb_29386959.mp3	بەڕای من ئەنفلەوەنزایەکی سووکە	
common_voice_ckb_29386966.mp3	ئەگەر شتێک نەزانی مەیڵێ ئەگەر زانیت نیوەی بڵێ	
common_voice_ckb_29386975.mp3	لە مێژە لە وی حاڵیم نە درۆیە نە بوختانە	
common_voice_ckb_29387000.mp3	لابەری میکرۆبات لەسەر پێست گەشەیپێدرا بە زیادکردنی سابوون یان تایت بۆ ئاو	
common_voice_ckb_29387004.mp3	پاشان چوو خوازبێنی کرد	
common_voice_ckb_29387009.mp3	پێویستە چاویلکە وەرگرم بۆ چاوەکانم	
common_voice_ckb_29387016.mp3	ماڵی باوکت سەرەوژێر بێ	
common_voice_ckb_29387022.mp3	یەک سڵاوم لێ دەکرد	
common_voice_ckb_29387052.mp3	باوکم جگە لەوەی قەرزدارە هەموو شەوێک خەڵک دەهاتنە ماڵمان بۆ وەرگرتنەوەی قەرزەکان	
