path	sentence	client_id
common_voice_ckb_29810806.mp3	دابان بە هەمووانی گوت کە ئەو سێ جار ئەو فیلمەی بینیوە	
common_voice_ckb_29810807.mp3	ئێمە تیۆرییەکمان هەیە	
common_voice_ckb_29810810.mp3	دەزانم بەئەنقەست وای کرد	
common_voice_ckb_29810811.mp3	ئۆی نا بیرم چوو جزدانەکەم بهێنم	
common_voice_ckb_29810828.mp3	بە قورئان بۆ من چاکی فەقیر و بەستەزمانی	
common_voice_ckb_29810849.mp3	من لەوان تێ ناگەم	
common_voice_ckb_29810877.mp3	ئازاد گوتی کە ئەو زۆر کونجکۆڵە	
common_voice_ckb_29810881.mp3	دوور نییە بهەەڵەدا نەچم	
common_voice_ckb_29810957.mp3	خاڵی هاوبەشت زۆرە لەگەڵ من	
common_voice_ckb_29810990.mp3	ئەنوەر کچەکەی لە کاتی جگەرەکێشان گرت	
common_voice_ckb_29810992.mp3	با هەوڵ بدەین ژیانێکی سوپاسگوزاری بژین	
common_voice_ckb_29810995.mp3	خوان هاوڵاتییەکی بەرازیلییە	
common_voice_ckb_29811066.mp3	ئەو تاکە کچی جووتیارێکی دەوڵەمەندی هۆڵەندی بوو	
common_voice_ckb_29811089.mp3	با پێکەوە بچینە سەر ئەو پردە	
common_voice_ckb_29811091.mp3	ڕەنگە ئێستا سەعید بگری	
common_voice_ckb_29811150.mp3	ناتوانین لەوە زیاتر کات بەفیڕۆ بدەین	
common_voice_ckb_29811198.mp3	بۆ ئەوەی ئەو کاریگەرییانەی ڤایرۆسەکە هەیەتی سنووردار بکرێن	
common_voice_ckb_29833136.mp3	چەند جۆرێک گۆڤار هەیە	
common_voice_ckb_29833148.mp3	کەس فریای نەکەوت	
common_voice_ckb_29833165.mp3	هەندێک پێشچوومە	
common_voice_ckb_29833200.mp3	سەری بچێت نوێژی ناچێت	
common_voice_ckb_29833202.mp3	شەش سەد و دوازدە	
common_voice_ckb_29833281.mp3	هەموو عومر	
common_voice_ckb_29833283.mp3	هیوادارم ئەمەتان بەدڵ بێت	
common_voice_ckb_29833328.mp3	ئەوە ڕێیەکی زۆر نوێکارانە بوو بۆ کردنی ئەوە	
common_voice_ckb_29833353.mp3	سەرۆکی کۆمپانیاکەتان کێیە	
common_voice_ckb_29833395.mp3	ئالان دوانیوەڕۆی ئەمڕۆ بۆ ماوەی دوو سەعات مەلەی کرد	
common_voice_ckb_29833439.mp3	دەمەوێت بزانم کێ ئەوەی پێداویت	
common_voice_ckb_29833468.mp3	ئێران پشتیوانیی دۆزی فەڵەستین دەکات	
common_voice_ckb_29833549.mp3	هەموو سیستەمەکانمان تێک چوون	
common_voice_ckb_29833550.mp3	ئەگەر پێویستت بە قەرزکردنی هەندێک پارەیە ئاگادارم بکەوە	
common_voice_ckb_29833554.mp3	ئەوە مەخۆن	
common_voice_ckb_29833622.mp3	دان توانی بێتاوانی خۆی بسەلمێنێت	
common_voice_ckb_29833700.mp3	سۆران ئەفسەری سوپایە	
common_voice_ckb_29833760.mp3	سپاردەی سبەی چییە	
common_voice_ckb_29833867.mp3	ناتوانم هەستەکانم بشارمەوە	
common_voice_ckb_29834032.mp3	تەنها دوو هەنگاو دوور لێرە دەژیم	
common_voice_ckb_29834034.mp3	کەریم زۆر بێئۆقرە بوو	
common_voice_ckb_29834077.mp3	لە پارێزگای هەڵەبجە بەردەوام لە بەرزبوونەوەدایە	
common_voice_ckb_29834103.mp3	ڕێبین گوتی کە ڕێ بە ئامینە دەدات بۆ ئەو کارە	
common_voice_ckb_29834115.mp3	ناتوانم بیر لە نموونەیەکی گونجاو بکەمەوە	
common_voice_ckb_29834225.mp3	گوتی ناتوانێت بە فەرەنسی قسە بکات	
common_voice_ckb_29834240.mp3	پێیان گوتم کە گوێیان لە دەنگی تەقە بووە	
common_voice_ckb_29834242.mp3	چیرۆکێکم بۆ بگێڕەوە کە کۆتایییەکی خۆشی هەبێت	
common_voice_ckb_29834262.mp3	باسی جەنگی دەستەویەخەی	
common_voice_ckb_29834291.mp3	دەتوانرێت کێشەکە بە لۆژیک چارەسەر بکرێت	
common_voice_ckb_29834320.mp3	بۆچی پۆلە زمانە عادەتییەکان ئەوەندە بێزارکەرن	
common_voice_ckb_29834363.mp3	چت دەوێ	
common_voice_ckb_29834368.mp3	هیچ شتێکی نائاسایی لەم بارەیەوە نییە	
common_voice_ckb_29834374.mp3	سێ ساڵ لەمەوبەر ژنەکەم کۆچی دوایی کرد	
common_voice_ckb_29834380.mp3	بە بەراورد لەگەڵ پێشتر لە ئێستاوە زۆر باشتر بووە	
common_voice_ckb_29834455.mp3	وای زانی دکتۆرم	
common_voice_ckb_29834459.mp3	تۆ زیاتر لە من دەخۆیت	
common_voice_ckb_29834461.mp3	باوکم هەمیشە دەیگوت ئاسمان یارمەتیی ئەوانە دەدات کە یارمەتیی خۆیان دەدەن	
common_voice_ckb_29834539.mp3	تاقیکردنەوەکە زۆر زەحمەت بوو	
common_voice_ckb_29834547.mp3	ئەنەس ئامادەیە بۆ سەرکێشی	
common_voice_ckb_29834561.mp3	پیاوێکی زۆر پیاوانەیە	
common_voice_ckb_29834581.mp3	مام خدر ئەحواڵت چۆنە	
common_voice_ckb_29834644.mp3	پێویست ناکات لەگەڵی بەڕێز بیت	
common_voice_ckb_29834685.mp3	یووسف تا چەند ساڵێک لەمەوبەر لە ئەفغانستان دەژیا	
common_voice_ckb_29842980.mp3	لە شاری کۆیە هاتۆتە دنیاوە	
common_voice_ckb_29843022.mp3	ئاراس بەدرێژاییی ئێوارە خواردییەوە	
common_voice_ckb_29843128.mp3	سەگەکە لەسەر قەنەفەکە دەخەوێت	
common_voice_ckb_29843163.mp3	دەڵێن شام شەکرە	
common_voice_ckb_29843220.mp3	دەربارەی ئیسلام بخوێننەوە	
common_voice_ckb_29843264.mp3	فڕۆکەیەک لەسەر شارەکە دەفڕێت	
common_voice_ckb_29843310.mp3	ئێمە چی دەکەین	
common_voice_ckb_29843332.mp3	هاتوومەتە ئێرە بۆ ئەوەی داوای لێبوردن بکەم	
common_voice_ckb_29843334.mp3	ئەوە دوو سەعاتە لێرەم	
common_voice_ckb_29861039.mp3	نێچیروان پێی وابوو کە ڤیان گاڵتە دەکات	
common_voice_ckb_29861050.mp3	ئەوە ئاشکرایە کە ئەو گرنگی بە ئێمە نادات	
common_voice_ckb_29861052.mp3	چیدیکە خۆم پێ ڕاناگیرێ دەبێ بچمە ئاودەست	
common_voice_ckb_29861059.mp3	پولێک ئاسکی گوڵبژێری	
common_voice_ckb_29861090.mp3	ئەوە نهێنییە	
common_voice_ckb_29861120.mp3	دەمانچەی پێ نییە	
common_voice_ckb_29861134.mp3	ئیبراهیم گوتی ئەو گۆرانی ناڵێت	
common_voice_ckb_29861135.mp3	دڵشکاوم	
common_voice_ckb_29861190.mp3	هەموو کەس لێرە ناوی تۆ دەزانێت	
common_voice_ckb_29861218.mp3	خواردن پۆشاک و شوێنی حەوانەوە بنەمای ژیانن	
common_voice_ckb_29861219.mp3	داهێنانەکەی شایانی سەرنجە	
common_voice_ckb_29861238.mp3	چالاک زۆر یارمەتیی ئێمەی نەدا	
common_voice_ckb_29861300.mp3	پێشتر سێ ڕێگەی جیاوازم تاقیکردووەتەوە	
common_voice_ckb_29861339.mp3	گوتی یەک شتیشی لەبیر نەماوە	
common_voice_ckb_29917958.mp3	ڕزگار زۆر لەوە بەتەمەنترە کە پێوەی دیارە	
common_voice_ckb_29917962.mp3	خەڵک ناتوانێت ئەوەی دەیەوێت یان پێویستی پێیەتی بیکڕێت	
common_voice_ckb_29917996.mp3	گەڕام بەڵام نەمدۆزییەوە	
common_voice_ckb_29918029.mp3	بیست و پێنج بیست و شەش بیست و حەوت	
common_voice_ckb_29918031.mp3	ئەو فیلمە ئۆسکارێکی بردەوە وەک باشترین فیلمی بیانی	
common_voice_ckb_29918039.mp3	دواتر هاتن هەموویانی لێیان سەند	
common_voice_ckb_29918090.mp3	خوا هەموومانی خۆش دەوێت	
common_voice_ckb_29918137.mp3	هیوادارم بەم زووانە بگەڕێیتەوە	
common_voice_ckb_29918142.mp3	من ئاشنای ئەم ناوچەیە نیم	
common_voice_ckb_29918198.mp3	خۆت بە کەم مەزانە	
common_voice_ckb_29918205.mp3	جوانی بەینەڵا جوانی بە ملوێنێ هەرزانی	
common_voice_ckb_29918207.mp3	ئاهەنگەکە سێ سەعات بەردەوام بوو	
common_voice_ckb_29918262.mp3	بیست بیست و یەک بیست و دوو بیست و سێ بیست و چوار	
common_voice_ckb_29918340.mp3	زۆربەی خەڵکی مەدرید بۆیان گرنگ نییە چی ڕوودەدات	
common_voice_ckb_29918393.mp3	نەک تەنیا ئەو بەڵکوو خوشکەکانیشی چوونە سینەما	
common_voice_ckb_29918416.mp3	ماڵی بارزان ئاگری تێ بەرببوو	
common_voice_ckb_29918424.mp3	چۆن ڕوونی بکەمەوە بۆ ئەوەی هەموو کەسێک لێی تێ بگات	
common_voice_ckb_29918500.mp3	ڕادیۆکەم پێکرد	
common_voice_ckb_29918501.mp3	و دەبێت نێرەکان لە مێیەکان جیابکرێنەوە	
common_voice_ckb_29918537.mp3	لەوانە بوو تووشی هەزار بەڵا ببم	
common_voice_ckb_29918540.mp3	بۆچی جێگر لەبارەی شتێکی وا درۆ دەکات	
common_voice_ckb_29918572.mp3	ئەم جارە جیاواز دەبێت	
common_voice_ckb_29918575.mp3	فاتیمە دەڵێت زۆر ماندووە و ناتوانێت هیچ شتێکی تر بکات	
common_voice_ckb_29918594.mp3	جارێکی دیکە ئەو هەڵەیە ناکەم	
common_voice_ckb_29918597.mp3	چیت بۆ بکەم	
common_voice_ckb_29918629.mp3	چەقۆیەک لە مەتبەخەکە هەڵبگرە	
common_voice_ckb_29918636.mp3	من ئادەمی ناو بهەەشت بووم	
common_voice_ckb_29918642.mp3	چەوەندەری پیرانشار	
common_voice_ckb_29918671.mp3	زۆربەی کچان پێیان وایە جوانن	
common_voice_ckb_29918672.mp3	چەکی نییە	
common_voice_ckb_29918693.mp3	بەتایبەتیش کاتێک باس دێتە سەر پێکهێنانی حکوومەتی نوێ	
common_voice_ckb_29918696.mp3	کامێرایەکم گۆڕییەوە بە گیتارێک	
common_voice_ckb_29918699.mp3	با کاتی کەمتر تەرخان بکەین بۆ دەمەقاڵێ و کاتی زیاتر بۆ کارکردن	
common_voice_ckb_29918713.mp3	ئەگەر بێدەنگ بم مانای ئەوە نییە کە من هاوڕام لەگەڵ ئێوە	
common_voice_ckb_29918738.mp3	کتێبێکی ڕێزمانم هەیە	
common_voice_ckb_29918771.mp3	جەمال ئەوەی پێویست بوو کردی	
common_voice_ckb_29918772.mp3	خانەوادەکەی لەکوێن	
common_voice_ckb_29918773.mp3	کوڕەکە خەریکی خوێندنەوەی کتێبەکەیەتی	
common_voice_ckb_29918808.mp3	زەکەریا دوێنێ شەو زۆر کەم خەوت	
common_voice_ckb_29918821.mp3	ساڵی چەند لەدایک بووی	
common_voice_ckb_29918872.mp3	ئەم میوەیە هێشتا ئەوەندە پێنەگەیشتووە تا لێبکرێتەوە	
common_voice_ckb_29918877.mp3	سی دەقەتان دەدەمێ تا خۆتان ئامادە بکەن	
common_voice_ckb_29918893.mp3	ئێرە شوێنێکی مەترسیدارە	
common_voice_ckb_29918910.mp3	زۆر شانازی بە کچەکەیەوە دەکات	
common_voice_ckb_29918922.mp3	چاوەکانت قەپات بکە	
common_voice_ckb_29918923.mp3	لەلایەن وەزارەتی دەرەوەی تورکیاوە فرمانی بۆ دەرچووبوو	
common_voice_ckb_29918968.mp3	سەنگەر لە سارا زیرەکتر نییە	
common_voice_ckb_29918971.mp3	کێ دڵخوازترین گۆرانیبێژی کەنەدایی تۆیە	
common_voice_ckb_29918997.mp3	بێباکییەکەی بووە هۆی ڕووداوێک	
common_voice_ckb_29919017.mp3	ئەوە ئامانجەکەمان بوو	
common_voice_ckb_29919018.mp3	بەسەختی دەخوێنێت تا بتوانێت لە تاقیکردنەوەکان دەربچێت	
common_voice_ckb_29919055.mp3	پێکەنیم	
common_voice_ckb_29919057.mp3	باوەڕتان بە موعجیزەکان هەیە	
common_voice_ckb_29919086.mp3	پشکنینی خوێن ئاسایییە	
common_voice_ckb_29919127.mp3	ئەم پەرداخە شکاوە	
common_voice_ckb_29919133.mp3	حامید دوێنێ ڕۆژینی بینی کە ماچی ئەلەندی دەکرد	
common_voice_ckb_29919168.mp3	ئەگەر من بوومایە ئامۆژگارییەکانیم جێبەجێ دەکرد	
common_voice_ckb_29939680.mp3	چەقووەکە هی باخەوانەکەیە	
common_voice_ckb_29939686.mp3	حەزم لە بۆنکردنی گوڵانە	
common_voice_ckb_29939709.mp3	بە بڕوای ئەحمەد هەموو شتێک بەباشی دەڕۆشت بەڕێوە	
common_voice_ckb_29939715.mp3	حاڵم باش نییە	
common_voice_ckb_29939717.mp3	هیچ شتێک هەیە کە پێویستت پێی بێت	
common_voice_ckb_29939729.mp3	خیانەتکار نیم	
common_voice_ckb_29939730.mp3	ناحیەی سمیلان دەکەوێتە قەزای چۆمان سەر بە پارێزگای هەولێر	
common_voice_ckb_29939732.mp3	تکایە ئەمە لای ژنەکەم باس مەکەن	
common_voice_ckb_29939736.mp3	تەواوی ڕۆژەکەم بە پاککردنەوەی ژوورەکە بەسەر برد	
common_voice_ckb_29939754.mp3	سەیری ڕەسمەکەی مەکە	
common_voice_ckb_29939755.mp3	شتێک نەما بەدیی نەکەم	
common_voice_ckb_29939832.mp3	بڕۆ ئەبووبەکر بەخەبەر بێنەوە	
common_voice_ckb_29939860.mp3	دەرباز زۆر زۆر دەخواتەوە	
common_voice_ckb_29939862.mp3	عەلی دەزانێت کە ئەو ڕاستە	
common_voice_ckb_29939879.mp3	پێدەکەنی	
common_voice_ckb_29939880.mp3	ئێوە زۆر میەرەبانن	
common_voice_ckb_29939882.mp3	بۆچی لەسەر شتێکی وا تووڕە دەبێت	
common_voice_ckb_29939904.mp3	هەموو بەیانییەک پیاسەیەک دەکات	
common_voice_ckb_29939905.mp3	سەعید لە زۆر ڕووەوە وەک باوکیەتی	
common_voice_ckb_29939906.mp3	قەت لەبەر لێخوڕینی خێرا غەرامە کراویت	
common_voice_ckb_29939944.mp3	بابەتی دڵخوازی من ماتماتیکە	
common_voice_ckb_29939988.mp3	زۆر حەزم لەو تەیرانەیە	
common_voice_ckb_29939997.mp3	هەرگیز درۆی لەگەڵ ناکەم	
common_voice_ckb_29940012.mp3	من پێنج ڕۆژ کار دەکەم لە هەفتەیەک	
common_voice_ckb_29940017.mp3	ڕۆژێکیان باش ئامۆژگاریی کردم	
common_voice_ckb_29940018.mp3	بەهەمان شێوە منیش خۆشحاڵ بووم	
common_voice_ckb_29940039.mp3	کێ کارەبای داهێنا	
common_voice_ckb_29940088.mp3	کتێبەکەی زۆر سەرنجڕاکێشە	
common_voice_ckb_29940105.mp3	دەمتان بکەنەوە	
common_voice_ckb_29940158.mp3	ئەو پیاوە بە لهەجەی سنەیی زمانی کوردی قسە دەکات	
common_voice_ckb_29940162.mp3	پێم بڵێ کاتێک گەڕایەوە	
common_voice_ckb_29940171.mp3	حوسێن کارێکی زۆر گرنگی هەیە	
common_voice_ckb_29940207.mp3	هیچ مێزێک لە ژوورەکەدا نییە	
common_voice_ckb_29940242.mp3	هەموو پارەکە سەرف مەکە	
common_voice_ckb_29940243.mp3	کابرای دوکاندار باش لەوە تێگەیشت	
common_voice_ckb_29940279.mp3	سەگەکان باشترین هاوڕێی مرۆڤن	
common_voice_ckb_29940336.mp3	لەگەڵ وەزارەتی پەروەردە ڕێک کەوتووین کە ڕۆژێک دابنێین	
common_voice_ckb_29940338.mp3	تکایە گڵۆپەکە بکوژێننەوە	
common_voice_ckb_29940376.mp3	ئێستا ئیشی گرنگترم هەیە بیکەم	
common_voice_ckb_29940383.mp3	من خائین نیم	
common_voice_ckb_29940438.mp3	ئەم کچە ئەو کچە نییە	
common_voice_ckb_29940439.mp3	مەریەم یەکەم دڵبەرم بوو	
common_voice_ckb_29940440.mp3	کوا دایە	
common_voice_ckb_29940493.mp3	زۆر گیانلەبەر لە جیهاندا قڕ بوون	
common_voice_ckb_29940502.mp3	حوسێن شتێکی لە دەرەوە بیست	
common_voice_ckb_29940513.mp3	دەمانەوێت ڕای تۆ ببیستین	
common_voice_ckb_29940515.mp3	چەتۆ دیوێکی باش و دیوێکی خراپی هەیە	
common_voice_ckb_29940565.mp3	هەموو پەنجەرەکانتان قوفڵ دا	
common_voice_ckb_29940583.mp3	لۆ نوێژی سبەینێ بانگم بکە	
common_voice_ckb_29940588.mp3	پێویستم بە فێڵکردن لە کەس نییە	
common_voice_ckb_29940638.mp3	ئەم بابەتەم هەڵبژارد چونکە پێم وایە سەرنجڕاکێشە	
common_voice_ckb_29940643.mp3	ماشەڵا لە بووک و زاوای شۆخ و جوان	
common_voice_ckb_29940645.mp3	باوەڕ وا بوو کە نەهەنگەکان ماسین	
common_voice_ckb_29940658.mp3	تازە هەندێک هەواڵی خۆشم پێ گەیشت	
common_voice_ckb_29940683.mp3	با ڕەچەتەی هەندێک دەرمانت بۆ بنووسم	
common_voice_ckb_29940684.mp3	بە تەلەفۆن قسە دەکەم	
common_voice_ckb_29940689.mp3	چۆن زانیت کە عەزیز ئەو کەسەیە کە ئەم ساندویچانەی دروست کردووە	
common_voice_ckb_29940738.mp3	بە هیچ شێوەیەک کارێکی ئاسان نییە	
common_voice_ckb_29940740.mp3	چیتر ناهێڵێت لە باوەشی بگرم	
common_voice_ckb_29980521.mp3	پێم ناکرێ ئەگەنا ئێستا بەسەر ئەو شاخ و چیایانە دەکەوتم	
common_voice_ckb_29980524.mp3	سبەی ئەوەی پێویستم پێیەتی دەیکڕم	
common_voice_ckb_29980528.mp3	خاڵی سنووریی حاجی ئۆمەران دەکەوێتە پارێزگای هەولێر	
common_voice_ckb_29980546.mp3	کەس بە دۆی خۆی ناڵێت ترشە	
common_voice_ckb_29980547.mp3	ئەنەس پێی خۆشە باسی منداڵەکانی بکات	
common_voice_ckb_29980593.mp3	ئەمڕۆ زۆر گەرم نییە وەک دوێنێ	
common_voice_ckb_29980634.mp3	ڕۆژان بڕیاری خۆی دا کە بچێتە کۆلێژی یاسا	
common_voice_ckb_29980635.mp3	بە شێوازێکی تر باس لە نیشتمان دەکات	
common_voice_ckb_29980638.mp3	دەبێت زۆر وشە و ڕستە لەبەر بکەم	
common_voice_ckb_29980663.mp3	من ئەمە بە ڕاست دەزانم	
common_voice_ckb_29980666.mp3	بۆ من وا دەردەکەوێت کە ئەو زۆر بێباکە	
common_voice_ckb_29980695.mp3	دەتەوێت دەرگاکە دابخەم	
common_voice_ckb_29980712.mp3	قورئانەکەی برد بۆ ماڵەوە	
common_voice_ckb_29980717.mp3	مامۆستایانی ئایینی لە وتاری هەینی و لە وتارەکانی ڕۆژانەیاندا ئاماژەیان بەوە کرد	
common_voice_ckb_29980718.mp3	چەند شتێک هەیە پێویستە بیانکڕم	
common_voice_ckb_29980747.mp3	ڕێبوار نایەت بۆ کار	
common_voice_ckb_29980749.mp3	بارزان هەوڵ دەدات بگات بە دیلان	
common_voice_ckb_29980773.mp3	موالید چەندی	
common_voice_ckb_29980774.mp3	چییە بۆ وا ڕەنگت تێکچووە	
common_voice_ckb_29980817.mp3	زۆر حەزم لە زمانەکانە	
common_voice_ckb_29980824.mp3	یەکێک لە نوێنەرانی خوێندکارانی ناڕازی	
common_voice_ckb_29980856.mp3	گوێم لێ بوو کەسێک بانگی ناوی منی کرد	
common_voice_ckb_29980858.mp3	کاتێک کار دەکەم حەزم لە گوێگرتنە لە مۆسیقا	
common_voice_ckb_29980860.mp3	قیبلەنماکە لەکوێیە	
common_voice_ckb_29980864.mp3	لەخۆی بێگانە بووە	
common_voice_ckb_30022785.mp3	پۆلیس خەریکی پشکنینی ئۆتۆمۆبیلەکان بوو	
common_voice_ckb_30022787.mp3	قەت تامی سووپێکتان کردووە بەقەد ئەوە باش بێت	
common_voice_ckb_30022808.mp3	یووسف لەگەڵ کەژاڵ هاوڕا نییە	
common_voice_ckb_30022811.mp3	وەخت بوو بکەوێتە خوار	
common_voice_ckb_30022813.mp3	بارزان و دیلان دڵنیا نەبوون بتوانن ئەو کارە بکەن	
common_voice_ckb_30022855.mp3	هەموو کەس ناچارە خۆی بگونجێنێت	
common_voice_ckb_30022856.mp3	ئەو کۆمپیوتەرەکەم دەکڕێت	
common_voice_ckb_30022857.mp3	خەریک بوو خۆیان بکوژن	
common_voice_ckb_30022861.mp3	پار لە تەمەنی پیری مرد	
common_voice_ckb_30022868.mp3	تەنها ویستم چاوێک لە دەوروبەر بکەم	
common_voice_ckb_30022869.mp3	ڕۆژەکانی هاوین گەرمن	
common_voice_ckb_30022875.mp3	دایکم ژنێکی زۆر نایاب بوو	
common_voice_ckb_30022907.mp3	لە ژیانی تایبەتیم مەپرسن	
common_voice_ckb_30022908.mp3	ناسا خەریکی ئیش کردنە لەسەر ئەو بابەتە	
common_voice_ckb_30022910.mp3	دارێک هەیە	
common_voice_ckb_30022911.mp3	کێن وازی لە قسەکردن هێنا و دەستی کرد بە خواردن	
common_voice_ckb_30023076.mp3	فیلمی ئاکشنی دڵخوازت چییە	
common_voice_ckb_30023077.mp3	خوێندکارەکانی زۆر دەخوێنن	
common_voice_ckb_30023087.mp3	هەزار و شەش سەد و چل و هەشت	
common_voice_ckb_30023090.mp3	دەبێت وانەکەت فێر بیت	
common_voice_ckb_30023109.mp3	تەماتە و خەیاری باڵەکایەتی	
common_voice_ckb_30023111.mp3	تکایە وریا بن	
common_voice_ckb_30023112.mp3	زۆر کار ناکەم	
common_voice_ckb_30023114.mp3	ڕەنگە بەم زووانە دیدار بێتە پیرانشار	
common_voice_ckb_30023116.mp3	توانیویانە سەرسامییەکی گەورە لای بینەرانی خۆیان و مامۆستا ەونەرییەکانیشیان دروست بکەن	
common_voice_ckb_30023156.mp3	سینەماکە بەتەواوی پڕ بوو	
common_voice_ckb_30023158.mp3	ئەمن منداڵی دوێنێم ئەو بە من دەڵێ خاڵە	
common_voice_ckb_30023160.mp3	دەمەوێت واز لە کارەت بهێنیت	
common_voice_ckb_30023162.mp3	ئەم سەگە دوو مانگ لەمەوبەر لەدایک بووە	
common_voice_ckb_30023222.mp3	چینی و ئیسپانی دەخوێنم	
common_voice_ckb_30023267.mp3	ئەمەم زۆر پێ ناخۆشە	
common_voice_ckb_30023269.mp3	ئێمە دادپەروەریمان دەوێت	
common_voice_ckb_30023271.mp3	ئەم کاتژمێرە دەقیقە	
common_voice_ckb_30023406.mp3	ڕۆژین گوتی کلیلەکانی لە ماڵێ جێهێشتووە	
common_voice_ckb_30023407.mp3	تەواوی شەو بەخەبەر بووم بۆ نووسینی ئەم ڕاپۆرتە	
common_voice_ckb_30023409.mp3	محەممەد لەگەڵ من گریا	
common_voice_ckb_30023411.mp3	من زۆر حەزم لە خواردنی مەکسیکی نییە	
common_voice_ckb_30023501.mp3	جارێک شتێکی هاوشێوەم بەسەر هات	
common_voice_ckb_30023505.mp3	یاریی تۆپی سەبەتە لەگەڵ کێ دەکەیت	
common_voice_ckb_30023591.mp3	ئەمە کتێبێکە دەربارەی سیاسەتی گشتی	
common_voice_ckb_30023651.mp3	باخەکە ئاو بدەن	
common_voice_ckb_30023652.mp3	ئەوە دەڵێم کە بیری لێ دەکەمە	
common_voice_ckb_30023655.mp3	لە ڕۆژێکدا چەند جگەرە دەکێشیت	
common_voice_ckb_30070649.mp3	هەر دەڵێی پابێدەیە و دێتەوە لەسەر کانی	
common_voice_ckb_30070651.mp3	بۆچی لەگەڵی مایتەوە	
common_voice_ckb_30070653.mp3	تکایە قسەم پێ مەبڕە با هەمووی بڵێم	
common_voice_ckb_30070681.mp3	چ شتێکی شیرینت زۆر بەلاوە سەرنجڕاکێشە	
common_voice_ckb_30070710.mp3	خواردنەکەتان بخۆن	
common_voice_ckb_30070711.mp3	نامانەوێت ژمارە تەلەفۆنی خۆمانتان پێ بڵێین	
common_voice_ckb_30070714.mp3	ئەوەی پێویستمە سبەی دەیکڕم	
common_voice_ckb_30070750.mp3	ئێوارەخوان نزیک پازدە دەقەی دیکە ئامادە دەبێت	
common_voice_ckb_30070751.mp3	چ کاتێک ئەوان دەبینیت	
common_voice_ckb_30070752.mp3	پێت وایە هیچ چانسێک هەیە کە ئەوە ڕووبدات	
common_voice_ckb_30070754.mp3	بەدڵنیاییەوە ناگەڕێمەوە ئەوێ	
common_voice_ckb_30070780.mp3	بەڕێوەبەرایەتیی بایدن دەڵێت کار دەکات بۆ گێڕانەوەی ئەمریکا بۆ ڕێککەوتنەکە	
common_voice_ckb_30070781.mp3	حەزت لەم گەمەیە نییە	
common_voice_ckb_30070782.mp3	جگەرە ناکێشێت	
common_voice_ckb_30070784.mp3	چۆن بتوانم بەخێرایی کێشم داببەزێنم	
common_voice_ckb_30070786.mp3	ئەمڕۆ شتێکی زۆر سەیر ڕووی دا	
common_voice_ckb_30070811.mp3	بەدیاریکراوی لەبیرم نییە چیت گوت	
common_voice_ckb_30070817.mp3	هەولێر پایتەختی باشووری کوردستانە	
common_voice_ckb_30070818.mp3	خەلیل لە ئینستاگرام پەیامێکی بۆ هات	
common_voice_ckb_30089266.mp3	بابەتەکانتان بە تەختەکلیلی کوردی بنووسن	
common_voice_ckb_30089297.mp3	کارم کرد	
common_voice_ckb_30089378.mp3	بەبێ ئەوەی سەرنج بخرێتە سەر ئەم شتە ناپێویستانە	
common_voice_ckb_30089388.mp3	ئەمە ئۆتۆمۆبیلێکە بۆ گەنجان	
