path	sentence	client_id
common_voice_ckb_29353858.mp3	کەرەفتوو ئەگەرچی ئەشکەوتێکی سرووشتیە بەلام گۆڕانکاریەکانی مرۆڤی سەردەمی کۆنی تێدا ئاشکرایە	
common_voice_ckb_29353860.mp3	تۆم برای منە باوکی من نییە	
common_voice_ckb_29353955.mp3	ئەنجوومەنی پێشڤەچوونی زانستی ئەمریکا	
common_voice_ckb_29353957.mp3	کەڵەشێریش نەبێت ڕۆژ ئەبێتەوە	
common_voice_ckb_29353959.mp3	من دەڵێم پەشێو یەکسانە بە هەولێر	
common_voice_ckb_29353996.mp3	ئەم نیشانانە لە کەیەوە بوونیان هەیە	
common_voice_ckb_29353998.mp3	من ناوم پرچە	
common_voice_ckb_29353999.mp3	بگرە هەنگوون و نەبات	
common_voice_ckb_29354052.mp3	بە وەی ڕقم لێی هەستا	
common_voice_ckb_29354053.mp3	دەچمەوە مەهابادێ	
common_voice_ckb_29354054.mp3	زیانەکانی ئەم ڤاکسینە هێشتا دیاری نەکراوە	
common_voice_ckb_29354090.mp3	لە بەرانبەریشیدا مرۆڤ خزمەتی ئاژەڵ دەکات	
common_voice_ckb_29354091.mp3	پێڵاوەکانی هەڵکێشا	
common_voice_ckb_29354094.mp3	دنیامان بۆ دەبێ ڕەوان	
common_voice_ckb_29354135.mp3	گەشتە ئاسمانییەکان دەست پێدەکەنەوە	
common_voice_ckb_29354138.mp3	مەتاڵی لە بن سەر داناوە	
common_voice_ckb_29354174.mp3	ماوەیەک لەوێ ماوەتەوە	
common_voice_ckb_29354175.mp3	گیانە دڵەی من	
common_voice_ckb_29354176.mp3	کارێکی نەشیاوە تۆڕی کۆمەڵایەتی بکرێتە سەرچاوەی هەر بابەتێکی تری زانستی	
common_voice_ckb_29354177.mp3	هیواداری ژیانێکی خۆش	
common_voice_ckb_29354178.mp3	دەست بگرێ بەسەر سیاسەتڕێژیی گشتیدا	
common_voice_ckb_29433879.mp3	هەموو بە گیان و بە سەر	
common_voice_ckb_29433882.mp3	ئیننا لیللاە و ئیننا ئیلەیەی ڕاجیعوون	
common_voice_ckb_29433883.mp3	فاتمە دوو چاوی مەستت شێتی کردم فاتمە	
common_voice_ckb_29433884.mp3	ئێوە جووت دەکەن	
common_voice_ckb_29433925.mp3	لە سەر مەحموودکانی	
common_voice_ckb_29433927.mp3	ئاسکی مەیدەشت و گۆرانە	
common_voice_ckb_29433928.mp3	توڕەیی و هەرا فیلمێکی ئێرانییە لە جۆری هەست بزوێن	
common_voice_ckb_29433967.mp3	تاوەکو ئێستا ناوی عێراق لە ئەجێندای کۆبوونەوەکاندا نییە	
common_voice_ckb_29433969.mp3	لە ڕاستیدا گەر خۆشەویستیت نەبێت بۆ ئەو کارەی دەیکەیت	
common_voice_ckb_29433970.mp3	وەکو ئاخر زەمانە	
common_voice_ckb_29433971.mp3	بەفران گرت لە کۆڵانە	
common_voice_ckb_29433973.mp3	بە من نابی ڕازی	
common_voice_ckb_29434026.mp3	ئێرەکە میراوایە بەشێکە لە بۆکانە	
common_voice_ckb_29434028.mp3	با شتێکتان پێبڵێم کە پێویستە بیزانن	
common_voice_ckb_29434029.mp3	بۆچی دەبێت بیکڕین	
common_voice_ckb_29434105.mp3	قەرز کۆن ئەبێت نافەوتێت	
common_voice_ckb_29434106.mp3	ئەو زۆر بەناوبانگە	
common_voice_ckb_29434107.mp3	داتای کلینیکی ئێمە لەگەڵ ڤایرۆسناسی لینک دەکرێت	
common_voice_ckb_29434109.mp3	پێی بڵێن خوارزات هات	
common_voice_ckb_29479517.mp3	کاتێک من سەبارەت بە منداڵبوون لە وڵاتانی دیکە بابەتم دەخوێندەوە بۆم دەرکەوت	
common_voice_ckb_29479518.mp3	یارمەتی	
common_voice_ckb_29479519.mp3	ئایا لە داهاتوودا کۆمپانیایەک دەتوانێت ڕکابەرییان بکات	
common_voice_ckb_29479520.mp3	دوای بڵاوبونەوەی ئیسلام و پێکهێنانی چەند دەوڵەتێک	
common_voice_ckb_29479557.mp3	ڤیدیۆکەم داگرت	
common_voice_ckb_29479558.mp3	میری بۆتان لە خوازبێنیی تاجدین خۆشحاڵ دەبێ و ستی و تاجدین زەماوەند دەکەن	
common_voice_ckb_29479561.mp3	لە ڕۆژهەڵاتی ناوەڕاست ئەنجام دەدرێت	
common_voice_ckb_29479562.mp3	دوای نزیکەی مانگێک لە داخرانی ڕێگای چین و وڵاتانی جیهان	
common_voice_ckb_29479593.mp3	جەنگی جیهانیی دووەم بە جەنگێکی گشتگیر دادەنرێت	
common_voice_ckb_29479594.mp3	نا	
common_voice_ckb_29479595.mp3	حەڵەب هەتا میسر و شام	
common_voice_ckb_29479598.mp3	بەغدا لەکاتی خۆیدا مووچە دەدات	
common_voice_ckb_29479616.mp3	ناسراوین بەو داوەتە	
common_voice_ckb_29479617.mp3	ئەو کەسە ژیرە پیری لە بیرە	
common_voice_ckb_29479618.mp3	مەکۆی زانیاری سەرهێڵ بۆ تەواوی گەلەکەمان	
common_voice_ckb_29479619.mp3	ئەگەر قەلم دەدەیێ	
common_voice_ckb_29479620.mp3	لای نیوەڕۆ دێم بۆ لات	
common_voice_ckb_29479650.mp3	ئەوەی زێڕەکەی وەرگرتووە بەوەی کە شووتییەکەی وەرگرتووە دەڵێ	
common_voice_ckb_29479651.mp3	ڕێکارەکانی کارکردن لە دوورەوە لە چەندین ناوچەی چین گیرایە بەر	
common_voice_ckb_29479652.mp3	ناوەندی ئەم پارێزگایە شاری سنەیە	
common_voice_ckb_29479654.mp3	گرتیان دەرگاەی ڕەحمان	
common_voice_ckb_29479655.mp3	دوعای دایک بۆ عەولاد	
common_voice_ckb_29479671.mp3	بە گۆرانی و بە هۆرە	
common_voice_ckb_29479673.mp3	هەروەها پووشە تام هەیە	
common_voice_ckb_29479674.mp3	چونکە گورگەکان تا ڕادەیەک کەمن	
common_voice_ckb_29479713.mp3	چۆن سوود لە بەستەر و بابەتەکانی پێشووت وەربگریت	
common_voice_ckb_29479714.mp3	سەری نایەشێت پەڕۆی لێ بەستووە	
common_voice_ckb_29479715.mp3	بازرگانی چالاکی و بەریەک کەوتنەکان وەستاون	
common_voice_ckb_29479716.mp3	لە لایەکی دیکەشەوە مێرسڤایرۆسی کۆڕۆنا ماوەیەکی زۆرە لە وشتردا بوونی هەبووە	
common_voice_ckb_29479717.mp3	سێ پێ مەودایەکی گونجاوە بۆ دووربوون لە کەسی نەخۆش	
common_voice_ckb_29479760.mp3	زیندانە کۆتوبەندە	
common_voice_ckb_29479762.mp3	خاک و ئەشکەوتەکانی کوردستانی لە بیر نەچووە	
common_voice_ckb_29479763.mp3	بەوە هەم نان پەیدا دەکات و هەم کاتیشی پێ بەسەر دەبات	
common_voice_ckb_29479776.mp3	کۆمپانیاکانی بواری وزەی ڕووسیا لە هەرێمی کوردستان چالاکییان هەیە	
common_voice_ckb_29479778.mp3	ڕێکخراوەکان هەشت مەرجیان لەسەر پڕۆژەکانی حکومەت ڕاگەیاند	
common_voice_ckb_29479826.mp3	گۆڕستانی چراکان لە شێرکۆ بێکەس	
common_voice_ckb_29479827.mp3	ئەم ماڵە بە بۆنەی تۆوە بەرپایە ئەزیزم	
common_voice_ckb_29479829.mp3	قورئانێکم پێ دا	
common_voice_ckb_29479830.mp3	نەشمیل گوڵی نەسرینە	
common_voice_ckb_29479857.mp3	زۆرێک پێیان وایە پاشەکشەی ئابووری چاوەڕوانکراوە	
common_voice_ckb_29479858.mp3	پرسیاریان کرد لە وانە	
common_voice_ckb_29479859.mp3	حکوومەت یان میری	
common_voice_ckb_29479860.mp3	ئایا هەست بە توندی دەکەیت لە سنگتدا	
common_voice_ckb_29479896.mp3	وەڵڵا بە کەس نەداوە	
common_voice_ckb_29479899.mp3	وەک شیزۆفرینیا	
common_voice_ckb_29479900.mp3	گۆزەکە لەسەر دیوارەکەیە	
common_voice_ckb_29479902.mp3	عانێ دەڕۆی بۆ سەیران	
common_voice_ckb_29479903.mp3	دەتوانن هەندێکم لەوە پێ بدەن	
common_voice_ckb_29558264.mp3	محەممەدی قازی وەرگێڕێکی گەورەیە	
common_voice_ckb_29593613.mp3	هەورازی بڵیند و نەوی	
common_voice_ckb_29593614.mp3	کە زۆر هات قەوارە بەتاڵە	
common_voice_ckb_29593688.mp3	کاتی نووستنە	
common_voice_ckb_29593689.mp3	دۆن کیشۆت چەند جارێک وەک فیلم بەرهەمهاتووە	
common_voice_ckb_29593691.mp3	بۆم وەرە دەرکی حەوشە	
common_voice_ckb_29593835.mp3	گرنگە لێکدانەوە بکەیت	
common_voice_ckb_29593836.mp3	یادی کۆچی داوی شاعیری گەورەی کورد	
common_voice_ckb_29593929.mp3	کاری تۆ چارەگێکە یان سێ سەعاتی ئەسەحییە	
common_voice_ckb_29593934.mp3	کۆمپانیاکانی مایکڕۆسافت گووگڵ و ئامازۆن	
common_voice_ckb_29593972.mp3	چاوێکم دێشێ یەکێکم تانە	
common_voice_ckb_29594002.mp3	ئەوەی لێرە ئێمە دەیکەین بریتیە لە بڵاوکردنەوەی ئەو شەپۆلانە	
common_voice_ckb_29594005.mp3	کاریگەریی گەورەی لەسەر خەڵکی نەبێ	
common_voice_ckb_29594044.mp3	هەردووکمان لە زانکۆین	
common_voice_ckb_29594125.mp3	چۆن نەشئەی کەللەم بزووت	
common_voice_ckb_29594127.mp3	لە ڕاستیدا دەبێت ئەوەمان لە پێشچاو بێت	
common_voice_ckb_29594166.mp3	پەیوەندیمان بە کۆلێجەکانی پزیشکیی ڤێتەرنەری و کشتوکاڵەوە کردووە	
common_voice_ckb_29594170.mp3	حاجی قادری کۆیی لە کۆیە لەدایک بوو	
common_voice_ckb_29630398.mp3	پێم وایە تۆم درۆم لەگەڵ دەکات	
common_voice_ckb_29630570.mp3	چیدی ناتوانرێت هیچ ئەندامێک بچێنرێت	
common_voice_ckb_29630573.mp3	ساز بە زوو بە مەبە گیر	
common_voice_ckb_29630577.mp3	جوچکە لە گەرمادا ناژی	
common_voice_ckb_29630672.mp3	بە تەندروستییەکی باشەوە ئازادی بکەم	
common_voice_ckb_29630675.mp3	تۆم ئەوەی گوت کە چەقۆیەکی پێبووە	
common_voice_ckb_29630676.mp3	بەژنێ باریکە ڕابرد ڕەبی کۆرە بم نەمدی	
common_voice_ckb_29630858.mp3	لە تورکیا فیلمێک لەم چیرۆکە دروست کرا	
common_voice_ckb_29631015.mp3	دەنوویت	
common_voice_ckb_29631115.mp3	ئایا لەناو خزمەکانتدا ئەو نیشانانە هەیە	
common_voice_ckb_29686955.mp3	یەکێکە لە زمانە هەرە بەربڵاوەکانی جیهان	
common_voice_ckb_29686956.mp3	هۆکارەکان بۆ ئەوە زۆرن	
common_voice_ckb_29687011.mp3	دایک زۆر دڵسۆزە	
common_voice_ckb_29687012.mp3	حەیران تایبەتە بە مۆسیقای کوردی	
common_voice_ckb_29687013.mp3	کاتێک منداڵەکە لەسەر پشت بێت	
common_voice_ckb_29687073.mp3	قاچی منداڵەکە بەرز دەکرێتەوە پشتی دێشێ	
common_voice_ckb_29687075.mp3	ڕووناکی هەر دوو چاوم	
common_voice_ckb_29687077.mp3	دووبارە چەشنی کەوباڕ	
common_voice_ckb_29687138.mp3	بۆ کۆمپانیا و نیشانە بازرگانییەکان ئەمە بههێزترین جۆرەکانی بڵاگە	
common_voice_ckb_29687140.mp3	خوێن لە عەرزی هاتە جۆش	
common_voice_ckb_29687142.mp3	تاسەی دایەگەورەم دەکەم	
common_voice_ckb_29687143.mp3	دەستی پێکرد لە ئاسیا	
common_voice_ckb_29687187.mp3	ناوچە تووشبووەکان چین	
common_voice_ckb_29687188.mp3	زۆر گرنگە کە ئارام بگریت و پڕهیوا و وزە بیت	
common_voice_ckb_29687190.mp3	فرمێسک دێ لە چاوانێ	
common_voice_ckb_29687191.mp3	لە دەستم دێ	
common_voice_ckb_29687251.mp3	حەقی خۆم لێو دەستێنم	
common_voice_ckb_29687252.mp3	ئەم بابەتە خوێندراوەتەوە	
common_voice_ckb_29687314.mp3	هاوژین و چوار منداڵی هەیە	
common_voice_ckb_29687315.mp3	پێم بڵێ ئەتۆ نێوت چییە	
common_voice_ckb_29687316.mp3	بزن بۆ شەوێکیش شوێنی خۆی خۆش ئەکات	
common_voice_ckb_29687317.mp3	برسێتی ڕەگی هاری بەدەمەوەیە	
common_voice_ckb_29687391.mp3	ببوورە پرسیارێکم هەیە	
common_voice_ckb_29687393.mp3	بەڵام ئێستا ڕێژەی باران بارینی تیا کەم بۆتەوە	
common_voice_ckb_29687394.mp3	پێویستە سەردانی پزیشک بکەم	
common_voice_ckb_29687450.mp3	لێیان ئەبێ بە نۆرە	
common_voice_ckb_29687451.mp3	کە ئیش ڕووی کردە تەواو	
common_voice_ckb_29687454.mp3	ژیانی لادێ و خۆشییەکانی	
common_voice_ckb_29728953.mp3	نە مەجنوونم نە فەرهادم	
common_voice_ckb_29728980.mp3	نیوە شەو بوو تەواوە	
common_voice_ckb_29729024.mp3	یان بازرگانێکی ئەو ماددانەیە	
common_voice_ckb_29729027.mp3	بەڵام هەندێک لەوانە بریتین لەوەی	
common_voice_ckb_29729057.mp3	فەرمووی نانی بێنن بۆ میوانان	
common_voice_ckb_29729213.mp3	فێری چۆنێتی بەکارهێنانی دەرمانەکانی دەکات	
common_voice_ckb_29729218.mp3	گامێش هەیە لە بەسڕە	
common_voice_ckb_29729296.mp3	ئەگەر بۆ خۆت بزانی	
common_voice_ckb_29729362.mp3	هەر شوێنێک دەستی ئەوانی پێگەیشتبێت	
common_voice_ckb_29729364.mp3	وەک لاوازبوونی توانای بینین و بیستن	
common_voice_ckb_29729396.mp3	قەت زەڕڕێک نەدەترسان	
common_voice_ckb_29729397.mp3	قەبارەکەی زۆرە	
common_voice_ckb_29729398.mp3	بەکاری دههێنێت	
common_voice_ckb_29729417.mp3	دیموکراتەکان لە هۆکاری سەرکەوتنەکانی ترامپ تێناگەن	
common_voice_ckb_29729418.mp3	زۆرترین داهاتی بەدەستهێنا	
common_voice_ckb_29729451.mp3	پێویستیمان بە پیاوانی وەک ئێوەیە	
common_voice_ckb_29729482.mp3	بەو پێیەی پیرەمێردیش وازی لە خوێندنەکەی هێنا بوو بە میرزا	
common_voice_ckb_29729569.mp3	ماوەی دوو هەفتەیە	
common_voice_ckb_29729628.mp3	سەرەڕای ئەمە هەندێک لە پسپۆڕەکان زۆر گەشبین نین	
common_voice_ckb_29729630.mp3	دوو سێ ڕۆژی بەمجۆرە	
common_voice_ckb_29729649.mp3	چۆن پەیوەندیت پێ بکەم	
common_voice_ckb_29748266.mp3	خوات لەگەڵ بێت	
common_voice_ckb_29748268.mp3	سەرم زۆر دێشێت	
common_voice_ckb_29808895.mp3	باسی ئینسان دەکات	
common_voice_ckb_29808896.mp3	هیچ شتێکی هەرزانترت هەیە	
common_voice_ckb_29808938.mp3	وریا بە گێرەوکێشە دروست نەکەیت	
common_voice_ckb_29808981.mp3	نامەوێت بەتەنیا بچم بۆ بازاڕکردن	
common_voice_ckb_29809057.mp3	دەبێت وەک ئەوەی پێت دەگوترێت بیکەیت	
common_voice_ckb_29809090.mp3	سی ساڵ لێرە ژیام	
common_voice_ckb_29809192.mp3	بەڵێ ئەوەندەی من ئاگادار بم	
common_voice_ckb_29809194.mp3	بە عومەر بڵێین	
common_voice_ckb_29809267.mp3	پشیلەکەی جەیمس تووڕەیە	
common_voice_ckb_29809374.mp3	چێژم لە سەردانی ژاپۆن وەرگرت	
common_voice_ckb_29809376.mp3	تکایە دەتوانی پێم بڵێیتەوە کە چەند جار لێرە بوویت	
common_voice_ckb_29809504.mp3	هەرگیز جارێکی دیکە لەو ڕێستورانتە نان ناخۆم	
common_voice_ckb_29809505.mp3	تۆ وەک منداڵێک ڕەفتار دەکەیت	
common_voice_ckb_29809507.mp3	ئەمە حاسیبەی ئەوە	
common_voice_ckb_29809572.mp3	هەوڵ دەدات قورئان لەبەر بکات	
common_voice_ckb_29809573.mp3	بەڕاستی نەدەبوو ئەوەندە ئایسکرێم بخۆم	
common_voice_ckb_29809624.mp3	بۆشایی پڕی نهێنییە	
common_voice_ckb_29809698.mp3	ئەو ڕووناکیی ژیانم بوو	
common_voice_ckb_29809750.mp3	زەکەریا پێی گوتم ئەو بەرگریی ئەو نەخۆشییەی هەیە	
common_voice_ckb_29809752.mp3	دەتەوێت لەگەڵ ئازاد بڕۆیت	
common_voice_ckb_29809806.mp3	ژیانم خۆش بوو	
common_voice_ckb_29817877.mp3	عەبدوڵڵا لە هەفتەیەکدا لانی کەم سێ جار حەمام دەکات	
common_voice_ckb_29817878.mp3	ئامۆژگارییەکانی ڕەوەز هەمیشە زۆر یارمەتیدەر بوون	
common_voice_ckb_29845478.mp3	شەمزین ئەوەندەی تۆ بەهێز نییە	
common_voice_ckb_29845553.mp3	ئەوەندەی جاران پێناکەنم	
common_voice_ckb_29867055.mp3	ئەم بوتڵە پڕ بکە لە ئاو	
common_voice_ckb_29867073.mp3	شەعبان لە دۆخێکی زۆر خراپە	
common_voice_ckb_29867094.mp3	بەو جلە جوان دەردەکەوێت	
common_voice_ckb_29908623.mp3	من لە ڕیۆ دەژیم	
common_voice_ckb_29908659.mp3	حەزم لەوە نییە	
common_voice_ckb_29908661.mp3	دەبوایە چاوەڕێی ئێمەت کردبا	
common_voice_ckb_29908663.mp3	دەتەوێت هیچت بۆ بهێنم	
common_voice_ckb_29908664.mp3	شۆفێری نازانێت	
common_voice_ckb_29908707.mp3	لە پێش چاوی ئەو منداڵانە شت مەخۆ	
common_voice_ckb_29908775.mp3	پاریس پایتەختی فەڕەنسایە	
common_voice_ckb_29908803.mp3	هێشتا من زمانی فەڕەنسیم ڕەوان نییە	
common_voice_ckb_29908804.mp3	تا چەند منداڵەکانت دەناسیت	
common_voice_ckb_29908843.mp3	بیرتان نەچێت بۆمان بنووسن	
common_voice_ckb_29908866.mp3	دوێنێ ڕاوکەر پاژنەی وەرگەڕاند	
common_voice_ckb_29908928.mp3	چێژ لە خوێندنەوەی وتارە زانستییەکان وەردەگرێت	
common_voice_ckb_29908957.mp3	نەمتوانی دەرگاکە بکەمەوە	
common_voice_ckb_29908958.mp3	چی وا زوو تۆی هێناوەتە ئێرە	
common_voice_ckb_29908962.mp3	خەریک بوو ئەوەندە پارەم هەبێت کە هەموو ئەو شتانە بکڕم کە پێویستم پێیان بوو	
common_voice_ckb_29908971.mp3	داب و نەریتە کۆمەڵایەتییەکان لە وڵاتێکەوە بۆ وڵاتێکی دیکە جیاوازن	
common_voice_ckb_29908974.mp3	ئاسانە بێتاقەتی بکەیت	
common_voice_ckb_29909017.mp3	هەموو ئەو هێلکانە تازە نین	
common_voice_ckb_29909036.mp3	مەبەستت چییە لە قەیرانی ناوەکی	
common_voice_ckb_29909060.mp3	چاوان بەبەلاش کردوویەتی	
common_voice_ckb_29909061.mp3	هەموو ئەوەی دەمویست ئەوە بوو دنیا داگیر بکەم ئەوە داوایەکی گەورە بوو	
common_voice_ckb_29909093.mp3	دەستەکانت لە دەرەوەی پەنجەرەکە جێمههێڵە	
common_voice_ckb_29909096.mp3	مستەفا دوو کیسەڵی هەیە	
common_voice_ckb_29909118.mp3	پێم وایە تۆ زۆر سەختگریت	
common_voice_ckb_29909185.mp3	سەیارەکەم شوشتووە	
common_voice_ckb_29909186.mp3	چەند سیمکارتتان هەیە	
common_voice_ckb_29909289.mp3	هەموو توانای خۆم دەخەمە گەڕ لە هەموو شتێک	
common_voice_ckb_29909291.mp3	ئاگای لێ دەبێت	
common_voice_ckb_29909294.mp3	وا چاکە ئەمشەو بچین بۆ بینینی فیلمێک	
common_voice_ckb_29909331.mp3	حەز دەکەم فێری ئینگلیزیی ستاندارد بم	
common_voice_ckb_29909335.mp3	پێم وایە تیۆرییەکم هەیە لەسەر ئەوە	
common_voice_ckb_29909359.mp3	سیاسەتوانەکە وەڵامی پرسیاری ڕۆژنامەنووسان دەداتەوە	
common_voice_ckb_29909361.mp3	پێویستم بە کاری ئێوە نییە	
common_voice_ckb_29909362.mp3	مەمنوونی هیچ فرۆشیارێک نەبووم	
common_voice_ckb_29909392.mp3	تکایە باسی خۆتمان بۆ بکە	
common_voice_ckb_29909396.mp3	ڤیان خۆی بڕی	
common_voice_ckb_29909453.mp3	دەمویست پیتزا بخۆم	
common_voice_ckb_29909469.mp3	هەر ئێستا ئەم ڕستەیە دەخوێنیتەوە	
common_voice_ckb_29909499.mp3	هێڵی ئینتەرنێتەکەم خاوە	
common_voice_ckb_29909500.mp3	حەز دەکەم ئاماژە بە یەک شتی تریش بدەم	
common_voice_ckb_29909501.mp3	تۆ زۆر کراوەیت	
common_voice_ckb_29909534.mp3	چاوێکم داخست	
common_voice_ckb_29909552.mp3	یارمەتیم دەدەن لە چاندنی ئەم تۆوانە	
common_voice_ckb_29909554.mp3	خێرا ڕامان کرد تا نەمانگرن	
common_voice_ckb_29909556.mp3	یارمەتیدانی ئەو هەڵەیەک بوو	
common_voice_ckb_29909583.mp3	دەتوانیت ڕووناکییەکە بکوژێنیتەوە	
common_voice_ckb_29909604.mp3	کەسێک لە گەراجەکەمانە	
common_voice_ckb_29909605.mp3	خولەکێک کاتتان هەیە	
common_voice_ckb_29909641.mp3	دەتوانم دەست لە ڕیشت بدەم	
common_voice_ckb_29909644.mp3	ئەحمەد داودئۆغڵو سەرۆک وەزیری پێشووی تورکیا بوو	
common_voice_ckb_29909645.mp3	گیانەکەم تووڕەبوونت لێ نایەت	
common_voice_ckb_29909684.mp3	عوسمان ئەمەی کرد نەک من	
common_voice_ckb_29909721.mp3	یەکێک لە نوێنەرانی خوێندکارە ناڕازییەکانی زانکۆ	
common_voice_ckb_29909747.mp3	عەلی هیچی نەکرد بۆ یارمەتیدانی ڤیان	
common_voice_ckb_29909799.mp3	براکانم هێشتا وەڵامی پرسیارەکانتیان نەداوەتەوە	
common_voice_ckb_29909802.mp3	بیکەن	
common_voice_ckb_29909855.mp3	دەزانیت کە ئەو هەستە چۆنە	
common_voice_ckb_29909856.mp3	کچەکەمان بە شقارتەیەک پەنجەی خۆی سووتاند	
common_voice_ckb_29909895.mp3	هەموو باڵندەیەک ناتوانێت بچڕێت	
common_voice_ckb_29922653.mp3	کاتێک هەواڵەکەی بیست ڕەنگی سپی بوو	
common_voice_ckb_29922658.mp3	من و ئارام هەردووکمان ڕاستییەکە دەزانین	
common_voice_ckb_29922660.mp3	پشتی خۆم شکاند	
common_voice_ckb_29922718.mp3	ماندوو بووم لە خوێندنەوە	
common_voice_ckb_29922719.mp3	هەشت سەد و شازدە	
common_voice_ckb_29922760.mp3	ژوورەکان هەموو خاوێنن	
common_voice_ckb_29922761.mp3	درکم بەوە نەکرد کە جدییت	
common_voice_ckb_29922787.mp3	لەگەڵ خۆی پرتەوبۆڵە دەکات	
common_voice_ckb_29922841.mp3	وا خۆم پیشان دا کە خەواڵووم	
common_voice_ckb_29922846.mp3	کەسێک دەدۆزمەوە	
common_voice_ckb_29922882.mp3	یارمەتیی ئەو دەدەین	
common_voice_ckb_29922919.mp3	متمانەتان پێی هەیە	
common_voice_ckb_29922954.mp3	خواتان لەگەڵ بێت	
common_voice_ckb_29922988.mp3	شاسوار پەیوەندییەکەی پچڕاندووە لەگەڵ لەیلا	
common_voice_ckb_29922990.mp3	هەموو ئەوانە دەگۆڕم	
common_voice_ckb_29923013.mp3	ژووری چاوەڕوانی بەتاڵە	
common_voice_ckb_29923015.mp3	فێربوونی فەڕەنسی سەخت بوو	
common_voice_ckb_29923050.mp3	پرسیارگەلێکی زۆر دێنە ئاراوە سەبارەت بەوەی چۆن حکوومەت دەتوانێت کێشەکان چارەسەر بکات	
common_voice_ckb_29923051.mp3	هەندێک جار ئازارم هەیە	
common_voice_ckb_29923052.mp3	باوکت چ چەشنە کارێک دەکات	
common_voice_ckb_29923085.mp3	ئەو جلکانەم بۆ بدروو دەبێ بۆ جەژن ئامادە بن	
common_voice_ckb_29923119.mp3	هەمان شتی کارزانم داوا کرد	
common_voice_ckb_29923153.mp3	بە هیچ شێوەیەک شیرم ناوێت	
common_voice_ckb_29923154.mp3	ناتوانم قاچەکانم بجوڵێنم	
common_voice_ckb_29923156.mp3	لەبیرت نەچێت دوای ژەمەکان و پێش خەوتن ددانەکانت بشۆیت	
common_voice_ckb_29923186.mp3	ئەو ئەو جۆرە پیاوەیە کە ژن زۆر بەجددی وەرناگرێت	
common_voice_ckb_29923188.mp3	ویستم ئەمڕۆ ئەوە بکەم	
common_voice_ckb_29923189.mp3	هەر بۆم گرنگ نییە	
common_voice_ckb_29923234.mp3	دڵگرانین بە لەدەستدانەکەتان	
common_voice_ckb_29923284.mp3	دەمەوێت بێمەوە ماڵ	
common_voice_ckb_29923327.mp3	دەبێت هەوڵ بدەیت	
common_voice_ckb_29924176.mp3	لەبیرم چووە پاسپۆرتەکەم لەکوێ داناوە	
common_voice_ckb_29941705.mp3	بارودۆخی دیدار و ئامینە زۆر باش نییە	
common_voice_ckb_29941706.mp3	کاتێکی زۆرت هەبوو	
common_voice_ckb_29941723.mp3	پێم وابوو قەرار نییە باسی ڕابەر بکەین	
common_voice_ckb_29941724.mp3	نۆژەنکردنەوە و پاراستنی دەقە کۆنەکان	
common_voice_ckb_29941726.mp3	حەز دەکەیت سەردانی چ وڵاتێک بکەیت	
common_voice_ckb_29941727.mp3	ژیانی لە گەڕان بەدوای حەقیقەت بەسەر برد	
common_voice_ckb_29941759.mp3	دەتوانیت ئەو کتێبانەم پێ بدەیت	
